{
  "type": "minecraft:smithing_transform",
  "template": {
    "item": "minecraft:netherite_upgrade_smithing_template"
  },
  "base": {
    "item": "entomology:diamond_bug_net"
  },
  "addition": {
    "item": "minecraft:netherite_ingot"
  },
  "result": {
    "id": "entomology:netherite_bug_net",
    "count": 1
  }
}
