{
  "type": "minecraft:crafting_shaped",
  "category": "decorations",
  "pattern": ["IBI", "PCP", "PPP"],
  "key": {
    "I": {
      "item": "minecraft:iron_ingot"
    },
    "B": {
      "item": "minecraft:book"
    },
    "P": {
      "item": "minecraft:oak_planks"
    },
    "C": {
      "item": "minecraft:crafting_table"
    }
  },
  "result": {
    "id": "entomology:research_station",
    "count": 1
  }
}
