{
  "type": "minecraft:crafting_shaped",
  "category": "decorations",
  "pattern": ["GGG", "G G", "PPP"],
  "key": {
    "G": {
      "item": "minecraft:glass_pane"
    },
    "P": {
      "item": "minecraft:oak_planks"
    }
  },
  "result": {
    "id": "entomology:display_case",
    "count": 1
  }
}
